{
  "format_version": 1,
  "name": "canonical-form-reprojects-to-itself",
  "description": "A document already in fully canonical projection form re-projects to a structurally identical document -- build_projection is a fixed point on its own output, so a canonical projection re-registered as input mints the same spec_id.",
  "identity_version": "spec1",
  "classification": "positive",
  "coverage": [
    "projection.idempotent-round-trip",
    "binding-states.value",
    "binding-states.set",
    "slots.sort-by-property",
    "entities.sort-dedup",
    "facets.non-sparse",
    "window.range.full"
  ],
  "notes": "Every individual member of this input is already in the exact shape build_projection produces: slots in property-sorted order, a multi-ref slot set already sorted and de-duplicated (no singleton collapse needed), a singleton slot binding already in value form, entity role keys and arrays already sorted and de-duplicated, facet axis keys already sorted, and a ref already in precomposed NFC form. input is therefore structurally a fixed point of build_projection -- expected_projection matches it under the same structural JSON equality this suite's other vectors use, member order not asserted -- and canonical_bytes/spec_id pin the byte-level consequence: JCS(expected_projection) and the id it mints, which is what a reader re-registering a previously-served canonical document must reproduce exactly. That distinguishes this vector from the many others that each show one normalisation rule converging a non-canonical input onto a canonical output.",
  "input": {
    "identity_version": "spec1",
    "shape": {
      "kind": "statvar_schema",
      "measured_property": "developmentFinanceFlow"
    },
    "slots": [
      {
        "property": "DevelopmentFinancePurpose",
        "binding": {
          "state": "set",
          "refs": [
            "Education",
            "Malaria"
          ]
        }
      },
      {
        "property": "DevelopmentFinanceScheme",
        "binding": {
          "state": "value",
          "ref": "GrantsScheme"
        }
      }
    ],
    "entities": {
      "origin": [
        "country/FRA",
        "country/USA"
      ],
      "destination": [
        "country/TGO"
      ]
    },
    "facets": {
      "measurementMethod": {
        "state": "value",
        "ref": "GrantEquivalent"
      },
      "provenance": {
        "state": "value",
        "ref": "test/CaféFixture"
      },
      "unit": {
        "state": "value",
        "request": {
          "base_year": 2023,
          "currency": "EUR",
          "prices": "constant"
        }
      }
    },
    "requested_window": {
      "kind": "range",
      "start_year": 2015,
      "end_year": 2024
    }
  },
  "expected_projection": {
    "identity_version": "spec1",
    "shape": {
      "kind": "statvar_schema",
      "measured_property": "developmentFinanceFlow"
    },
    "slots": [
      {
        "property": "DevelopmentFinancePurpose",
        "binding": {
          "state": "set",
          "refs": [
            "Education",
            "Malaria"
          ]
        }
      },
      {
        "property": "DevelopmentFinanceScheme",
        "binding": {
          "state": "value",
          "ref": "GrantsScheme"
        }
      }
    ],
    "entities": {
      "origin": [
        "country/FRA",
        "country/USA"
      ],
      "destination": [
        "country/TGO"
      ]
    },
    "requested_window": {
      "kind": "range",
      "start_year": 2015,
      "end_year": 2024
    },
    "facets": {
      "measurementMethod": {
        "state": "value",
        "ref": "GrantEquivalent"
      },
      "provenance": {
        "state": "value",
        "ref": "test/CaféFixture"
      },
      "unit": {
        "state": "value",
        "request": {
          "currency": "EUR",
          "prices": "constant",
          "base_year": 2023
        }
      }
    }
  },
  "canonical_bytes": "7b22656e746974696573223a7b2264657374696e6174696f6e223a5b22636f756e7472792f54474f225d2c226f726967696e223a5b22636f756e7472792f465241222c22636f756e7472792f555341225d7d2c22666163657473223a7b226d6561737572656d656e744d6574686f64223a7b22726566223a224772616e744571756976616c656e74222c227374617465223a2276616c7565227d2c2270726f76656e616e6365223a7b22726566223a22746573742f436166c3a946697874757265222c227374617465223a2276616c7565227d2c22756e6974223a7b2272657175657374223a7b22626173655f79656172223a323032332c2263757272656e6379223a22455552222c22707269636573223a22636f6e7374616e74227d2c227374617465223a2276616c7565227d7d2c226964656e746974795f76657273696f6e223a227370656331222c227265717565737465645f77696e646f77223a7b22656e645f79656172223a323032342c226b696e64223a2272616e6765222c2273746172745f79656172223a323031357d2c227368617065223a7b226b696e64223a22737461747661725f736368656d61222c226d656173757265645f70726f7065727479223a22646576656c6f706d656e7446696e616e6365466c6f77227d2c22736c6f7473223a5b7b2262696e64696e67223a7b2272656673223a5b22456475636174696f6e222c224d616c61726961225d2c227374617465223a22736574227d2c2270726f7065727479223a22446576656c6f706d656e7446696e616e6365507572706f7365227d2c7b2262696e64696e67223a7b22726566223a224772616e7473536368656d65222c227374617465223a2276616c7565227d2c2270726f7065727479223a22446576656c6f706d656e7446696e616e6365536368656d65227d5d7d",
  "spec_id": "spec_a9c7688350cdcd3bdbb63aff7f33fc29"
}
