{
  "format_version": 1,
  "name": "limit-schema-roles-at-limit",
  "description": "An entities map with exactly 16 role keys, the schema's published maximum role count, canonicalises normally.",
  "identity_version": "spec1",
  "classification": "positive",
  "coverage": [
    "limits.schema.roles.at-limit"
  ],
  "notes": "The schema's maximum entity-role count is 16. Role keys use the reserved test/ fixture namespace and are invented purely to reach the count; role-vs-graph validity (whether a role is declared and compatible with the resolved shape) is graph-dependent and explicitly out of this suite's scope, so an invented role key that no real shape declares is fine here. See limit-schema-roles-over-limit for the one-past-limit refusal.",
  "input": {
    "identity_version": "spec1",
    "shape": {
      "kind": "statvar_schema",
      "measured_property": "developmentFinanceFlow"
    },
    "slots": [
      {
        "property": "DevelopmentFinancePurpose",
        "binding": {
          "state": "unbound"
        }
      }
    ],
    "entities": {
      "test/role-00": [
        "country/FRA"
      ],
      "test/role-01": [
        "country/FRA"
      ],
      "test/role-02": [
        "country/FRA"
      ],
      "test/role-03": [
        "country/FRA"
      ],
      "test/role-04": [
        "country/FRA"
      ],
      "test/role-05": [
        "country/FRA"
      ],
      "test/role-06": [
        "country/FRA"
      ],
      "test/role-07": [
        "country/FRA"
      ],
      "test/role-08": [
        "country/FRA"
      ],
      "test/role-09": [
        "country/FRA"
      ],
      "test/role-10": [
        "country/FRA"
      ],
      "test/role-11": [
        "country/FRA"
      ],
      "test/role-12": [
        "country/FRA"
      ],
      "test/role-13": [
        "country/FRA"
      ],
      "test/role-14": [
        "country/FRA"
      ],
      "test/role-15": [
        "country/FRA"
      ]
    },
    "requested_window": {
      "kind": "all"
    }
  },
  "expected_projection": {
    "identity_version": "spec1",
    "shape": {
      "kind": "statvar_schema",
      "measured_property": "developmentFinanceFlow"
    },
    "slots": [
      {
        "property": "DevelopmentFinancePurpose",
        "binding": {
          "state": "unbound"
        }
      }
    ],
    "entities": {
      "test/role-00": [
        "country/FRA"
      ],
      "test/role-01": [
        "country/FRA"
      ],
      "test/role-02": [
        "country/FRA"
      ],
      "test/role-03": [
        "country/FRA"
      ],
      "test/role-04": [
        "country/FRA"
      ],
      "test/role-05": [
        "country/FRA"
      ],
      "test/role-06": [
        "country/FRA"
      ],
      "test/role-07": [
        "country/FRA"
      ],
      "test/role-08": [
        "country/FRA"
      ],
      "test/role-09": [
        "country/FRA"
      ],
      "test/role-10": [
        "country/FRA"
      ],
      "test/role-11": [
        "country/FRA"
      ],
      "test/role-12": [
        "country/FRA"
      ],
      "test/role-13": [
        "country/FRA"
      ],
      "test/role-14": [
        "country/FRA"
      ],
      "test/role-15": [
        "country/FRA"
      ]
    },
    "requested_window": {
      "kind": "all"
    }
  },
  "canonical_bytes": "7b22656e746974696573223a7b22746573742f726f6c652d3030223a5b22636f756e7472792f465241225d2c22746573742f726f6c652d3031223a5b22636f756e7472792f465241225d2c22746573742f726f6c652d3032223a5b22636f756e7472792f465241225d2c22746573742f726f6c652d3033223a5b22636f756e7472792f465241225d2c22746573742f726f6c652d3034223a5b22636f756e7472792f465241225d2c22746573742f726f6c652d3035223a5b22636f756e7472792f465241225d2c22746573742f726f6c652d3036223a5b22636f756e7472792f465241225d2c22746573742f726f6c652d3037223a5b22636f756e7472792f465241225d2c22746573742f726f6c652d3038223a5b22636f756e7472792f465241225d2c22746573742f726f6c652d3039223a5b22636f756e7472792f465241225d2c22746573742f726f6c652d3130223a5b22636f756e7472792f465241225d2c22746573742f726f6c652d3131223a5b22636f756e7472792f465241225d2c22746573742f726f6c652d3132223a5b22636f756e7472792f465241225d2c22746573742f726f6c652d3133223a5b22636f756e7472792f465241225d2c22746573742f726f6c652d3134223a5b22636f756e7472792f465241225d2c22746573742f726f6c652d3135223a5b22636f756e7472792f465241225d7d2c226964656e746974795f76657273696f6e223a227370656331222c227265717565737465645f77696e646f77223a7b226b696e64223a22616c6c227d2c227368617065223a7b226b696e64223a22737461747661725f736368656d61222c226d656173757265645f70726f7065727479223a22646576656c6f706d656e7446696e616e6365466c6f77227d2c22736c6f7473223a5b7b2262696e64696e67223a7b227374617465223a22756e626f756e64227d2c2270726f7065727479223a22446576656c6f706d656e7446696e616e6365507572706f7365227d5d7d",
  "spec_id": "spec_77a14577e6078c9b374132da0d08822c"
}
