{
  "format_version": 1,
  "name": "open-roles-empty-list-converges",
  "description": "An explicit empty open_roles list is omitted from the projection and mints the same id as open-roles-absent-origin-diverges, which omits the member.",
  "identity_version": "spec1",
  "classification": "positive",
  "coverage": [
    "open-roles.empty-list-omitted-convergence"
  ],
  "notes": "Deliberately shares its spec_id with open-roles-absent-origin-diverges: the sparse rule that keeps every document without open roles at its existing id.",
  "input": {
    "identity_version": "spec1",
    "shape": {
      "kind": "statvar_schema",
      "measured_property": "developmentFinanceFlow"
    },
    "slots": [
      {
        "property": "DevelopmentFinancePurpose",
        "binding": {
          "state": "value",
          "ref": "Malaria"
        }
      }
    ],
    "entities": {
      "destination": [
        "country/TGO"
      ]
    },
    "open_roles": [],
    "requested_window": {
      "kind": "all"
    }
  },
  "expected_projection": {
    "identity_version": "spec1",
    "shape": {
      "kind": "statvar_schema",
      "measured_property": "developmentFinanceFlow"
    },
    "slots": [
      {
        "property": "DevelopmentFinancePurpose",
        "binding": {
          "state": "value",
          "ref": "Malaria"
        }
      }
    ],
    "entities": {
      "destination": [
        "country/TGO"
      ]
    },
    "requested_window": {
      "kind": "all"
    }
  },
  "canonical_bytes": "7b22656e746974696573223a7b2264657374696e6174696f6e223a5b22636f756e7472792f54474f225d7d2c226964656e746974795f76657273696f6e223a227370656331222c227265717565737465645f77696e646f77223a7b226b696e64223a22616c6c227d2c227368617065223a7b226b696e64223a22737461747661725f736368656d61222c226d656173757265645f70726f7065727479223a22646576656c6f706d656e7446696e616e6365466c6f77227d2c22736c6f7473223a5b7b2262696e64696e67223a7b22726566223a224d616c61726961222c227374617465223a2276616c7565227d2c2270726f7065727479223a22446576656c6f706d656e7446696e616e6365507572706f7365227d5d7d",
  "spec_id": "spec_05fb85f3020e36e058da48e8fe9836a1"
}
