{
  "format_version": 1,
  "name": "numeric-integer-spelling-converges",
  "description": "A start_year given as a 16-character plain integer literal (10^15) canonicalises to the same bytes and mints the same id as the identical value spelled in float form. Paired with numeric-float-spelling-converges.",
  "identity_version": "spec1",
  "classification": "positive",
  "coverage": [
    "numeric.spelling-convergence"
  ],
  "notes": "Deliberately shares its spec_id with numeric-float-spelling-converges.json -- both spellings evaluate to the identical IEEE-754 double and JCS serialises that double identically regardless of how the source literal was spelled, so the two vectors converge on one id rather than colliding by accident (mirrors the facets-explicit-empty-object-converges/facets-omitted-member-converges precedent). The value 1000000000000000 is not a calendar-year claim, only a magnitude chosen safely below 2^53-1 -- mirrors numeric-negative-zero's stance on its own domain-odd value.",
  "input_bytes": "7b226964656e746974795f76657273696f6e223a227370656331222c227368617065223a7b226b696e64223a22737461747661725f736368656d61222c226d656173757265645f70726f7065727479223a22646576656c6f706d656e7446696e616e6365466c6f77227d2c22736c6f7473223a5b7b2270726f7065727479223a22446576656c6f706d656e7446696e616e6365507572706f7365222c2262696e64696e67223a7b227374617465223a2276616c7565222c22726566223a224d616c61726961227d7d5d2c22656e746974696573223a7b226f726967696e223a5b22636f756e7472792f465241225d7d2c227265717565737465645f77696e646f77223a7b226b696e64223a2272616e6765222c2273746172745f79656172223a313030303030303030303030303030307d7d",
  "expected_projection": {
    "identity_version": "spec1",
    "shape": {
      "kind": "statvar_schema",
      "measured_property": "developmentFinanceFlow"
    },
    "slots": [
      {
        "property": "DevelopmentFinancePurpose",
        "binding": {
          "state": "value",
          "ref": "Malaria"
        }
      }
    ],
    "entities": {
      "origin": [
        "country/FRA"
      ]
    },
    "requested_window": {
      "kind": "range",
      "start_year": 1000000000000000
    }
  },
  "canonical_bytes": "7b22656e746974696573223a7b226f726967696e223a5b22636f756e7472792f465241225d7d2c226964656e746974795f76657273696f6e223a227370656331222c227265717565737465645f77696e646f77223a7b226b696e64223a2272616e6765222c2273746172745f79656172223a313030303030303030303030303030307d2c227368617065223a7b226b696e64223a22737461747661725f736368656d61222c226d656173757265645f70726f7065727479223a22646576656c6f706d656e7446696e616e6365466c6f77227d2c22736c6f7473223a5b7b2262696e64696e67223a7b22726566223a224d616c61726961222c227374617465223a2276616c7565227d2c2270726f7065727479223a22446576656c6f706d656e7446696e616e6365507572706f7365227d5d7d",
  "spec_id": "spec_0967e62c5df5879b6da780afe59b392e"
}
