{
  "format_version": 1,
  "name": "binding-states-value-diverges-from-exact",
  "description": "A document sharing shape, entities, and window with binding-states-exact, differing only in its one slot's binding state ('value' in place of 'exact') on the same ref, mints a different id from that sibling.",
  "identity_version": "spec1",
  "classification": "positive",
  "coverage": [
    "binding-states.value",
    "binding-states.exact-divergence-pair"
  ],
  "notes": "Pins the divergence binding-states-exact's notes describe: 'exact(P)' and 'value(P)' on the same code are different identities, so their ids differ even though every other member of the document is byte-identical. 'value' here denotes DevelopmentFinancePurposeGroup110 plus its subtree; 'exact' in the sibling vector denotes the code alone. docs/identity-v1.md states the rule; neither this suite nor this vector decides it.",
  "input": {
    "identity_version": "spec1",
    "shape": {
      "kind": "statvar_schema",
      "measured_property": "developmentFinanceFlow"
    },
    "slots": [
      {
        "property": "DevelopmentFinancePurpose",
        "binding": {
          "state": "value",
          "ref": "DevelopmentFinancePurposeGroup110"
        }
      }
    ],
    "entities": {
      "origin": [
        "country/FRA"
      ]
    },
    "requested_window": {
      "kind": "all"
    }
  },
  "expected_projection": {
    "identity_version": "spec1",
    "shape": {
      "kind": "statvar_schema",
      "measured_property": "developmentFinanceFlow"
    },
    "slots": [
      {
        "property": "DevelopmentFinancePurpose",
        "binding": {
          "state": "value",
          "ref": "DevelopmentFinancePurposeGroup110"
        }
      }
    ],
    "entities": {
      "origin": [
        "country/FRA"
      ]
    },
    "requested_window": {
      "kind": "all"
    }
  },
  "canonical_bytes": "7b22656e746974696573223a7b226f726967696e223a5b22636f756e7472792f465241225d7d2c226964656e746974795f76657273696f6e223a227370656331222c227265717565737465645f77696e646f77223a7b226b696e64223a22616c6c227d2c227368617065223a7b226b696e64223a22737461747661725f736368656d61222c226d656173757265645f70726f7065727479223a22646576656c6f706d656e7446696e616e6365466c6f77227d2c22736c6f7473223a5b7b2262696e64696e67223a7b22726566223a22446576656c6f706d656e7446696e616e6365507572706f736547726f7570313130222c227374617465223a2276616c7565227d2c2270726f7065727479223a22446576656c6f706d656e7446696e616e6365507572706f7365227d5d7d",
  "spec_id": "spec_b12a9b8ef737a916a45d826aa31c16e2"
}
