{
  "format_version": 1,
  "name": "binding-states-exact",
  "description": "A slot binding with state 'exact' on a hierarchical code denotes the bound code alone, the deliberate parent-only ask, in contrast to 'value' on the same code denoting the code plus its subtree.",
  "identity_version": "spec1",
  "classification": "positive",
  "coverage": [
    "binding-states.exact"
  ],
  "notes": "Paired with binding-states-value-diverges-from-exact, an otherwise byte-identical document with 'value' in place of 'exact' on the same ref, which mints a different id: exact(P) and value(P) are two distinct identities with one denotation each, docs/identity-v1.md.",
  "input": {
    "identity_version": "spec1",
    "shape": {
      "kind": "statvar_schema",
      "measured_property": "developmentFinanceFlow"
    },
    "slots": [
      {
        "property": "DevelopmentFinancePurpose",
        "binding": {
          "state": "exact",
          "ref": "DevelopmentFinancePurposeGroup110"
        }
      }
    ],
    "entities": {
      "origin": [
        "country/FRA"
      ]
    },
    "requested_window": {
      "kind": "all"
    }
  },
  "expected_projection": {
    "identity_version": "spec1",
    "shape": {
      "kind": "statvar_schema",
      "measured_property": "developmentFinanceFlow"
    },
    "slots": [
      {
        "property": "DevelopmentFinancePurpose",
        "binding": {
          "state": "exact",
          "ref": "DevelopmentFinancePurposeGroup110"
        }
      }
    ],
    "entities": {
      "origin": [
        "country/FRA"
      ]
    },
    "requested_window": {
      "kind": "all"
    }
  },
  "canonical_bytes": "7b22656e746974696573223a7b226f726967696e223a5b22636f756e7472792f465241225d7d2c226964656e746974795f76657273696f6e223a227370656331222c227265717565737465645f77696e646f77223a7b226b696e64223a22616c6c227d2c227368617065223a7b226b696e64223a22737461747661725f736368656d61222c226d656173757265645f70726f7065727479223a22646576656c6f706d656e7446696e616e6365466c6f77227d2c22736c6f7473223a5b7b2262696e64696e67223a7b22726566223a22446576656c6f706d656e7446696e616e6365507572706f736547726f7570313130222c227374617465223a226578616374227d2c2270726f7065727479223a22446576656c6f706d656e7446696e616e6365507572706f7365227d5d7d",
  "spec_id": "spec_aaabbbb27779be9a4ecae1609b4ee991"
}
