{
  "format_version": 1,
  "name": "unicode-decomposed-nfc",
  "description": "A byte-level positive case: a ref string given in decomposed Unicode form (\"e\" U+0065 followed by combining acute accent U+0301) normalises to its precomposed NFC form (\"e\" with acute U+00E9) before hashing. Also demonstrates that a facets member with no bound axis is omitted entirely (sparse rule) and exercises the all window kind.",
  "identity_version": "spec1",
  "classification": "positive",
  "coverage": [
    "unicode.nfc.decomposed-to-composed",
    "facets.sparse-omission",
    "window.all"
  ],
  "notes": "The ref value uses an explicitly-reserved test/ fixture namespace, not a real or spec-worked-example dcid, since this string exists purely to carry the encoding edge case -- see schemas/vectors/README.md's fixture vocabulary. input_bytes is required here per schemas/vectors/README.md's input vs input_bytes rule: re-serialising the decomposed string through any tool's own JSON writer while assembling this fixture could silently normalise it, defeating the point of the vector, so the exact UTF-8 bytes are carried opaque and hex-encoded instead.",
  "input_bytes": "7b226964656e746974795f76657273696f6e223a227370656331222c227368617065223a7b226b696e64223a22737461747661725f736368656d61222c226d656173757265645f70726f7065727479223a22646576656c6f706d656e7446696e616e6365466c6f77227d2c22736c6f7473223a5b7b2270726f7065727479223a22446576656c6f706d656e7446696e616e6365507572706f7365222c2262696e64696e67223a7b227374617465223a2276616c7565222c22726566223a22746573742f43616665cc8146697874757265227d7d5d2c22656e746974696573223a7b226f726967696e223a5b22636f756e7472792f465241225d7d2c227265717565737465645f77696e646f77223a7b226b696e64223a22616c6c227d7d",
  "expected_projection": {
    "identity_version": "spec1",
    "shape": {
      "kind": "statvar_schema",
      "measured_property": "developmentFinanceFlow"
    },
    "slots": [
      {
        "property": "DevelopmentFinancePurpose",
        "binding": {
          "state": "value",
          "ref": "test/CaféFixture"
        }
      }
    ],
    "entities": {
      "origin": [
        "country/FRA"
      ]
    },
    "requested_window": {
      "kind": "all"
    }
  },
  "canonical_bytes": "7b22656e746974696573223a7b226f726967696e223a5b22636f756e7472792f465241225d7d2c226964656e746974795f76657273696f6e223a227370656331222c227265717565737465645f77696e646f77223a7b226b696e64223a22616c6c227d2c227368617065223a7b226b696e64223a22737461747661725f736368656d61222c226d656173757265645f70726f7065727479223a22646576656c6f706d656e7446696e616e6365466c6f77227d2c22736c6f7473223a5b7b2262696e64696e67223a7b22726566223a22746573742f436166c3a946697874757265222c227374617465223a2276616c7565227d2c2270726f7065727479223a22446576656c6f706d656e7446696e616e6365507572706f7365227d5d7d",
  "spec_id": "spec_4e69f50d87e40eff23ddcf03f06a30ec"
}
