{
  "format_version": 1,
  "name": "unit-request-currency-string-current",
  "description": "A unit conversion request naming a concrete ISO 4217 currency string, current prices, no base_year -- the string shape's baseline positive case.",
  "identity_version": "spec1",
  "classification": "positive",
  "coverage": [
    "unit-request.currency-string"
  ],
  "input": {
    "identity_version": "spec1",
    "shape": {
      "kind": "statvar_schema",
      "measured_property": "developmentFinanceFlow"
    },
    "slots": [
      {
        "property": "DevelopmentFinancePurpose",
        "binding": {
          "state": "value",
          "ref": "Malaria"
        }
      }
    ],
    "entities": {
      "origin": [
        "country/FRA"
      ]
    },
    "facets": {
      "unit": {
        "state": "value",
        "request": {
          "currency": "USD",
          "prices": "current"
        }
      }
    },
    "requested_window": {
      "kind": "all"
    }
  },
  "expected_projection": {
    "identity_version": "spec1",
    "shape": {
      "kind": "statvar_schema",
      "measured_property": "developmentFinanceFlow"
    },
    "slots": [
      {
        "property": "DevelopmentFinancePurpose",
        "binding": {
          "state": "value",
          "ref": "Malaria"
        }
      }
    ],
    "entities": {
      "origin": [
        "country/FRA"
      ]
    },
    "requested_window": {
      "kind": "all"
    },
    "facets": {
      "unit": {
        "state": "value",
        "request": {
          "currency": "USD",
          "prices": "current"
        }
      }
    }
  },
  "canonical_bytes": "7b22656e746974696573223a7b226f726967696e223a5b22636f756e7472792f465241225d7d2c22666163657473223a7b22756e6974223a7b2272657175657374223a7b2263757272656e6379223a22555344222c22707269636573223a2263757272656e74227d2c227374617465223a2276616c7565227d7d2c226964656e746974795f76657273696f6e223a227370656331222c227265717565737465645f77696e646f77223a7b226b696e64223a22616c6c227d2c227368617065223a7b226b696e64223a22737461747661725f736368656d61222c226d656173757265645f70726f7065727479223a22646576656c6f706d656e7446696e616e6365466c6f77227d2c22736c6f7473223a5b7b2262696e64696e67223a7b22726566223a224d616c61726961222c227374617465223a2276616c7565227d2c2270726f7065727479223a22446576656c6f706d656e7446696e616e6365507572706f7365227d5d7d",
  "spec_id": "spec_61a59f3c8c525b34296254cf8658da1e"
}
