{
  "format_version": 1,
  "name": "binding-states-all-unbound-retained",
  "description": "A described-arm document whose slots array carries two entries, both unbound, retains both: the unbound-slot-retention rule holds for a slots array with no bound survivor at all, extending beyond the mixed one-bound-one-unbound case binding-states-unbound already covers.",
  "identity_version": "spec1",
  "classification": "positive",
  "coverage": [
    "binding-states.all-unbound-retained",
    "projection.unbound-slot-retention"
  ],
  "notes": "Both slots survive in expected_projection, sorted by property, wire and projection equally dense. Its id differs from binding-states-no-slots-declared-diverges-from-all-unbound, which shares the same shape/entities/window but declares no slots at all: two shape-declared unbound slots and zero declared slots are different identities.",
  "input": {
    "identity_version": "spec1",
    "shape": {
      "kind": "statvar_schema",
      "measured_property": "developmentFinanceFlow"
    },
    "slots": [
      {
        "property": "DevelopmentFinancePurpose",
        "binding": {
          "state": "unbound"
        }
      },
      {
        "property": "DevelopmentFinanceScheme",
        "binding": {
          "state": "unbound"
        }
      }
    ],
    "entities": {
      "origin": [
        "country/FRA"
      ]
    },
    "requested_window": {
      "kind": "all"
    }
  },
  "expected_projection": {
    "identity_version": "spec1",
    "shape": {
      "kind": "statvar_schema",
      "measured_property": "developmentFinanceFlow"
    },
    "slots": [
      {
        "property": "DevelopmentFinancePurpose",
        "binding": {
          "state": "unbound"
        }
      },
      {
        "property": "DevelopmentFinanceScheme",
        "binding": {
          "state": "unbound"
        }
      }
    ],
    "entities": {
      "origin": [
        "country/FRA"
      ]
    },
    "requested_window": {
      "kind": "all"
    }
  },
  "canonical_bytes": "7b22656e746974696573223a7b226f726967696e223a5b22636f756e7472792f465241225d7d2c226964656e746974795f76657273696f6e223a227370656331222c227265717565737465645f77696e646f77223a7b226b696e64223a22616c6c227d2c227368617065223a7b226b696e64223a22737461747661725f736368656d61222c226d656173757265645f70726f7065727479223a22646576656c6f706d656e7446696e616e6365466c6f77227d2c22736c6f7473223a5b7b2262696e64696e67223a7b227374617465223a22756e626f756e64227d2c2270726f7065727479223a22446576656c6f706d656e7446696e616e6365507572706f7365227d2c7b2262696e64696e67223a7b227374617465223a22756e626f756e64227d2c2270726f7065727479223a22446576656c6f706d656e7446696e616e6365536368656d65227d5d7d",
  "spec_id": "spec_5a5fea59154425c950ef1bdc5292d2c5"
}
