{
  "format_version": 1,
  "name": "limit-string-length-over-limit",
  "description": "A ref string of 1,025 Unicode code points, one past the maximum, measured before NFC normalisation, is refused before any further validation runs.",
  "identity_version": "spec1",
  "classification": "negative",
  "coverage": [
    "limits.string-length.over-limit"
  ],
  "notes": "The operative ref is \"test/\" (5 code points) followed by 510 repetitions of \"e\" U+0065 plus COMBINING ACUTE ACCENT U+0301, pre-NFC decomposed spelling: 1,025 code points before normalisation, one past the maximum. NFC composes each decomposed pair into a single precomposed \"é\" U+00E9, so the same ref is only 515 code points after normalisation, well under the limit. String length is counted after JSON escape decoding but before NFC normalisation, so a conformant implementation refuses this input at its true pre-NFC length; an implementation that normalises first and counts after NFC would wrongly accept it, and is caught. input_bytes is required for two independent reasons here: this is a structural-limit vector, so it must begin at the strict parse stage; and it is byte-sensitive in the strongest sense, since a JSON round-trip through any tool's own writer could NFC-launder the decomposed bytes into precomposed form and silently destroy the case under test.",
  "input_bytes": "7b226964656e746974795f76657273696f6e223a227370656331222c2273686170655f6964223a22646576656c6f706d656e7446696e616e6365466c6f77222c22736c6f7473223a5b7b2270726f7065727479223a22446576656c6f706d656e7446696e616e6365507572706f7365222c2262696e64696e67223a7b227374617465223a2276616c7565222c22726566223a22746573742f65cc8165cc8165cc8165cc8165cc8165cc8165cc8165cc8165cc8165cc8165cc8165cc8165cc8165cc8165cc8165cc8165cc8165cc8165cc8165cc8165cc8165cc8165cc8165cc8165cc8165cc8165cc8165cc8165cc8165cc8165cc8165cc8165cc8165cc8165cc8165cc8165cc8165cc8165cc8165cc8165cc8165cc8165cc8165cc8165cc8165cc8165cc8165cc8165cc8165cc8165cc8165cc8165cc8165cc8165cc8165cc8165cc8165cc8165cc8165cc8165cc8165cc8165cc8165cc8165cc8165cc8165cc8165cc8165cc8165cc8165cc8165cc8165cc8165cc8165cc8165cc8165cc8165cc8165cc8165cc8165cc8165cc8165cc8165cc8165cc8165cc8165cc8165cc8165cc8165cc8165cc8165cc8165cc8165cc8165cc8165cc8165cc8165cc8165cc8165cc8165cc8165cc8165cc8165cc8165cc8165cc8165cc8165cc8165cc8165cc8165cc8165cc8165cc8165cc8165cc8165cc8165cc8165cc8165cc8165cc8165cc8165cc8165cc8165cc8165cc8165cc8165cc8165cc8165cc8165cc8165cc8165cc8165cc8165cc8165cc8165cc8165cc8165cc8165cc8165cc8165cc8165cc8165cc8165cc8165cc8165cc8165cc8165cc8165cc8165cc8165cc8165cc8165cc8165cc8165cc8165cc8165cc8165cc8165cc8165cc8165cc8165cc8165cc8165cc8165cc8165cc8165cc8165cc8165cc8165cc8165cc8165cc8165cc8165cc8165cc8165cc8165cc8165cc8165cc8165cc8165cc8165cc8165cc8165cc8165cc8165cc8165cc8165cc8165cc8165cc8165cc8165cc8165cc8165cc8165cc8165cc8165cc8165cc8165cc8165cc8165cc8165cc8165cc8165cc8165cc8165cc8165cc8165cc8165cc8165cc8165cc8165cc8165cc8165cc8165cc8165cc8165cc8165cc8165cc8165cc8165cc8165cc8165cc8165cc8165cc8165cc8165cc8165cc8165cc8165cc8165cc8165cc8165cc8165cc8165cc8165cc8165cc8165cc8165cc8165cc8165cc8165cc8165cc8165cc8165cc8165cc8165cc8165cc8165cc8165cc8165cc8165cc8165cc8165cc8165cc8165cc8165cc8165cc8165cc8165cc8165cc8165cc8165cc8165cc8165cc8165cc8165cc8165cc8165cc8165cc8165cc8165cc8165cc8165cc8165cc8165cc8165cc8165cc8165cc8165cc8165cc8165cc8165cc8165cc8165cc8165cc8165cc8165cc8165cc8165cc8165cc8165cc8165cc8165cc8165cc8165cc8165cc8165cc8165cc8165cc8165cc8165cc8165cc8165cc8165cc8165cc8165cc8165cc8165cc8165cc8165cc8165cc8165cc8165cc8165cc8165cc8165cc8165cc8165cc8165cc8165cc8165cc8165cc8165cc8165cc8165cc8165cc8165cc8165cc8165cc8165cc8165cc8165cc8165cc8165cc8165cc8165cc8165cc8165cc8165cc8165cc8165cc8165cc8165cc8165cc8165cc8165cc8165cc8165cc8165cc8165cc8165cc8165cc8165cc8165cc8165cc8165cc8165cc8165cc8165cc8165cc8165cc8165cc8165cc8165cc8165cc8165cc8165cc8165cc8165cc8165cc8165cc8165cc8165cc8165cc8165cc8165cc8165cc8165cc8165cc8165cc8165cc8165cc8165cc8165cc8165cc8165cc8165cc8165cc8165cc8165cc8165cc8165cc8165cc8165cc8165cc8165cc8165cc8165cc8165cc8165cc8165cc8165cc8165cc8165cc8165cc8165cc8165cc8165cc8165cc8165cc8165cc8165cc8165cc8165cc8165cc8165cc8165cc8165cc8165cc8165cc8165cc8165cc8165cc8165cc8165cc8165cc8165cc8165cc8165cc8165cc8165cc8165cc8165cc8165cc8165cc8165cc8165cc8165cc8165cc8165cc8165cc8165cc8165cc8165cc8165cc8165cc8165cc8165cc8165cc8165cc8165cc8165cc8165cc8165cc8165cc8165cc8165cc8165cc8165cc8165cc8165cc8165cc8165cc8165cc8165cc8165cc8165cc8165cc8165cc8165cc8165cc8165cc8165cc8165cc8165cc8165cc8165cc8165cc8165cc8165cc8165cc8165cc8165cc8165cc8165cc8165cc8165cc8165cc8165cc8165cc8165cc8165cc8165cc8165cc8165cc8165cc8165cc8165cc8165cc8165cc8165cc8165cc8165cc8165cc8165cc8165cc8165cc8165cc8165cc81227d7d5d2c22656e746974696573223a7b226f726967696e223a5b22636f756e7472792f465241225d7d2c227265717565737465645f77696e646f77223a7b226b696e64223a22616c6c227d7d",
  "failure_category": "input_limit_exceeded"
}
