{
  "format_version": 1,
  "name": "binding-states-unbound",
  "description": "A shape-declared slot left unbound serialises on the wire as {state: unbound} and carries into the projection unchanged, alongside its bound sibling slot.",
  "identity_version": "spec1",
  "classification": "positive",
  "coverage": [
    "binding-states.unbound",
    "projection.unbound-slot-retention"
  ],
  "notes": "Both the wire and the projection stay dense: the unbound slot survives in expected_projection next to the bound one, sorted by property alongside it. Proves retention for one slot in isolation; whether a shape's complete declared-slot set is present in a dense wire document is a separate, graph-dependent claim -- see schemas/vectors/README.md's Scope section on the dense-slots invariant. Paired with binding-states-unbound-reprojects-to-itself, which takes this vector's own input as an already-canonical form and shows it is a fixed point.",
  "input": {
    "identity_version": "spec1",
    "shape": {
      "kind": "statvar_schema",
      "measured_property": "developmentFinanceFlow"
    },
    "slots": [
      {
        "property": "DevelopmentFinancePurpose",
        "binding": {
          "state": "value",
          "ref": "Malaria"
        }
      },
      {
        "property": "DevelopmentFinanceScheme",
        "binding": {
          "state": "unbound"
        }
      }
    ],
    "entities": {
      "origin": [
        "country/FRA"
      ]
    },
    "requested_window": {
      "kind": "all"
    }
  },
  "expected_projection": {
    "identity_version": "spec1",
    "shape": {
      "kind": "statvar_schema",
      "measured_property": "developmentFinanceFlow"
    },
    "slots": [
      {
        "property": "DevelopmentFinancePurpose",
        "binding": {
          "state": "value",
          "ref": "Malaria"
        }
      },
      {
        "property": "DevelopmentFinanceScheme",
        "binding": {
          "state": "unbound"
        }
      }
    ],
    "entities": {
      "origin": [
        "country/FRA"
      ]
    },
    "requested_window": {
      "kind": "all"
    }
  },
  "canonical_bytes": "7b22656e746974696573223a7b226f726967696e223a5b22636f756e7472792f465241225d7d2c226964656e746974795f76657273696f6e223a227370656331222c227265717565737465645f77696e646f77223a7b226b696e64223a22616c6c227d2c227368617065223a7b226b696e64223a22737461747661725f736368656d61222c226d656173757265645f70726f7065727479223a22646576656c6f706d656e7446696e616e6365466c6f77227d2c22736c6f7473223a5b7b2262696e64696e67223a7b22726566223a224d616c61726961222c227374617465223a2276616c7565227d2c2270726f7065727479223a22446576656c6f706d656e7446696e616e6365507572706f7365227d2c7b2262696e64696e67223a7b227374617465223a22756e626f756e64227d2c2270726f7065727479223a22446576656c6f706d656e7446696e616e6365536368656d65227d5d7d",
  "spec_id": "spec_05c956feb593aeb53f30d654bf682f6e"
}
